{
  "$schema": "https://json-schema.org/draft/2020-12/schema",
  "type": "object",
  "properties": {
    "schemaVersion": {
      "type": "number",
      "const": 1
    },
    "id": {
      "type": "string",
      "pattern": "^[a-z][a-z0-9-]{0,79}$"
    },
    "version": {
      "type": "string",
      "pattern": "^\\d+\\.\\d+\\.\\d+$"
    },
    "title": {
      "type": "string",
      "minLength": 1,
      "maxLength": 120
    },
    "description": {
      "type": "string",
      "minLength": 1,
      "maxLength": 2000
    },
    "license": {
      "type": "string",
      "minLength": 1,
      "maxLength": 100
    },
    "author": {
      "type": "string",
      "minLength": 1,
      "maxLength": 120
    },
    "category": {
      "type": "string",
      "pattern": "^[a-z][a-z0-9-]{0,79}$"
    },
    "tags": {
      "default": [],
      "maxItems": 16,
      "type": "array",
      "items": {
        "type": "string",
        "pattern": "^[a-z][a-z0-9-]{0,79}$"
      }
    },
    "parameters": {
      "maxItems": 64,
      "type": "array",
      "items": {
        "oneOf": [
          {
            "type": "object",
            "properties": {
              "id": {
                "type": "string",
                "pattern": "^[a-z][a-z0-9-]{0,79}$"
              },
              "label": {
                "type": "string",
                "minLength": 1,
                "maxLength": 120
              },
              "description": {
                "type": "string",
                "maxLength": 1000
              },
              "type": {
                "type": "string",
                "const": "string"
              },
              "multiline": {
                "type": "boolean"
              },
              "default": {
                "type": "string",
                "maxLength": 16000
              },
              "minLength": {
                "type": "integer",
                "minimum": 0,
                "maximum": 16000
              },
              "maxLength": {
                "type": "integer",
                "minimum": 1,
                "maximum": 16000
              }
            },
            "required": [
              "id",
              "label",
              "type"
            ],
            "additionalProperties": false
          },
          {
            "type": "object",
            "properties": {
              "id": {
                "type": "string",
                "pattern": "^[a-z][a-z0-9-]{0,79}$"
              },
              "label": {
                "type": "string",
                "minLength": 1,
                "maxLength": 120
              },
              "description": {
                "type": "string",
                "maxLength": 1000
              },
              "type": {
                "type": "string",
                "const": "number"
              },
              "default": {
                "type": "number"
              },
              "min": {
                "type": "number"
              },
              "max": {
                "type": "number"
              },
              "integer": {
                "type": "boolean"
              }
            },
            "required": [
              "id",
              "label",
              "type"
            ],
            "additionalProperties": false
          },
          {
            "type": "object",
            "properties": {
              "id": {
                "type": "string",
                "pattern": "^[a-z][a-z0-9-]{0,79}$"
              },
              "label": {
                "type": "string",
                "minLength": 1,
                "maxLength": 120
              },
              "description": {
                "type": "string",
                "maxLength": 1000
              },
              "type": {
                "type": "string",
                "const": "boolean"
              },
              "default": {
                "type": "boolean"
              }
            },
            "required": [
              "id",
              "label",
              "type"
            ],
            "additionalProperties": false
          },
          {
            "type": "object",
            "properties": {
              "id": {
                "type": "string",
                "pattern": "^[a-z][a-z0-9-]{0,79}$"
              },
              "label": {
                "type": "string",
                "minLength": 1,
                "maxLength": 120
              },
              "description": {
                "type": "string",
                "maxLength": 1000
              },
              "type": {
                "type": "string",
                "const": "enum"
              },
              "options": {
                "minItems": 1,
                "maxItems": 100,
                "type": "array",
                "items": {
                  "type": "string",
                  "minLength": 1,
                  "maxLength": 200
                }
              },
              "default": {
                "type": "string"
              }
            },
            "required": [
              "id",
              "label",
              "type",
              "options"
            ],
            "additionalProperties": false
          }
        ]
      }
    },
    "nodes": {
      "minItems": 1,
      "maxItems": 256,
      "type": "array",
      "items": {
        "type": "object",
        "properties": {
          "id": {
            "type": "string",
            "pattern": "^[a-z][a-z0-9-]{0,79}$"
          },
          "operation": {
            "type": "string",
            "pattern": "^[a-z][a-z0-9_.-]{0,127}$"
          },
          "version": {
            "type": "string",
            "minLength": 1,
            "maxLength": 80
          },
          "input": {
            "$ref": "#/$defs/__schema0"
          },
          "dependsOn": {
            "maxItems": 256,
            "type": "array",
            "items": {
              "type": "string",
              "pattern": "^[a-z][a-z0-9-]{0,79}$"
            }
          },
          "cache": {
            "type": "boolean"
          },
          "parameters": {
            "maxItems": 128,
            "type": "array",
            "items": {
              "type": "object",
              "properties": {
                "parameter": {
                  "type": "string",
                  "pattern": "^[a-z][a-z0-9-]{0,79}$"
                },
                "target": {
                  "type": "string",
                  "maxLength": 1024
                }
              },
              "required": [
                "parameter",
                "target"
              ],
              "additionalProperties": false
            }
          },
          "bindings": {
            "maxItems": 128,
            "type": "array",
            "items": {
              "type": "object",
              "properties": {
                "target": {
                  "type": "string",
                  "maxLength": 1024
                },
                "node": {
                  "type": "string",
                  "pattern": "^[a-z][a-z0-9-]{0,79}$"
                },
                "pointer": {
                  "type": "string",
                  "maxLength": 1024
                }
              },
              "required": [
                "target",
                "node",
                "pointer"
              ],
              "additionalProperties": false
            }
          }
        },
        "required": [
          "id",
          "operation",
          "version",
          "input"
        ],
        "additionalProperties": false
      }
    }
  },
  "required": [
    "schemaVersion",
    "id",
    "version",
    "title",
    "description",
    "license",
    "author",
    "category",
    "tags",
    "parameters",
    "nodes"
  ],
  "additionalProperties": false,
  "$defs": {
    "__schema0": {
      "anyOf": [
        {
          "type": "string"
        },
        {
          "type": "number"
        },
        {
          "type": "boolean"
        },
        {
          "type": "null"
        },
        {
          "type": "array",
          "items": {
            "$ref": "#/$defs/__schema0"
          }
        },
        {
          "type": "object",
          "propertyNames": {
            "type": "string"
          },
          "additionalProperties": {
            "$ref": "#/$defs/__schema0"
          }
        }
      ]
    }
  }
}
